{"status":"Failed","policy":{"name":"Webhooks","description":""},"findingKey":"0q25yaKk/fxn/zjqVHtjyw","findingId":"0q25yaKk/fxn/zjqVHtjyw","cloudGuardAccountId":"51722","origin":"Compliance Engine","bundle":{"name":"GCP CloudGuard Best Practices","description":"CloudGuard Best Practices for securing GCP Account","id":-9},"reportTime":"2023-06-09T09:04:54.86Z","rule":{"name":"Ensure that there are only GCP-managed service account keys for each service account","ruleId":"D9.GCP.IAM.04","description":"Managing your own service account keys will result higher change for key exposure. You should avoid using user managed keys.","remediation":"\n**From Portal**\n1. Go to the IAM page in the GCP Console using https://console.cloud.google.com/iam-admin/iam\n2. In the left navigation pane, click `Service accounts`. All service accounts and their corresponding keys are listed.\n3. Click the service account.\n4. Click the `edit` and delete the keys.\n\n**From Command Line**\nRun\n```\ngcloud iam service-accounts keys delete --iam-account=USER_MANAGED_SERVICE_ACCOUNT_EMAIL KEY_ID\n```\n\n**References**\n1. https://cloud.google.com/sdk/gcloud/reference/iam/service-accounts/keys/delete\n2. https://cloud.google.com/iam/docs/understanding-service-accounts#managing_service_accounts\n","complianceTags":"Identity and Access Management","logicHash":"FW9q2DT7EC5veV1iuFY91Q","severity":"High"},"account":{"id":"serious-conduit-389105","name":"GCP Demo Account NU","vendor":"GCP","dome9CloudAccountId":"ca5ef528-d8dd-41d8-a022-1a820a6adb60","organizationalUnitId":"00000000-0000-0000-0000-000000000000","organizationalUnitPath":""},"region":"Global","entity":{"displayName":"CloudGuard-Connect ","email":"cloudguard-connect@serious-conduit-389105.iam.gserviceaccount.com","oauth2ClientId":"107011996045550659146","projectId":"serious-conduit-389105","uniqueId":"107011996045550659146","keys":[{"keyAlgorithm":"KEY_ALG_RSA_2048","name":"projects/serious-conduit-389105/serviceAccounts/cloudguard-connect@serious-conduit-389105.iam.gserviceaccount.com/keys/73a51b4a085a4fecf512b238220f891ab7af6e33","privateKeyData":null,"privateKeyType":null,"publicKeyData":null,"validAfterTime":1686115964,"validBeforeTime":1750770052,"eTag":null,"managedBy":"System"},{"keyAlgorithm":"KEY_ALG_RSA_2048","name":"projects/serious-conduit-389105/serviceAccounts/cloudguard-connect@serious-conduit-389105.iam.gserviceaccount.com/keys/898ae23e2f6e676386f0dfbedd13b200b148e3db","privateKeyData":null,"privateKeyType":null,"publicKeyData":null,"validAfterTime":1686116146,"validBeforeTime":253402300799,"eTag":null,"managedBy":"User"}],"roles":["roles/cloudasset.viewer","roles/iam.securityReviewer","roles/viewer"],"auditConfigsExemption":null,"selfLink":null,"id":"107011996045550659146","type":"ServiceAccount","name":"projects/serious-conduit-389105/serviceAccounts/cloudguard-connect@serious-conduit-389105.iam.gserviceaccount.com","dome9Id":"8|ca5ef528-d8dd-41d8-a022-1a820a6adb60|ServiceAccount|projects/serious-conduit-389105/serviceAccounts/cloudguard-connect@serious-conduit-389105.iam.gserviceaccount.com","accountNumber":"serious-conduit-389105","assetLabels":null,"region":"Global","externalFindings":null},"remediationActions":[],"action":"Detect","additionalFields":[]}